Name,Title,Description,Size,Stock,Price,Place,Link,SEO Title,SEO Description,SEO Keywords
ARCHITECT,Флуоресцентное полотно Архитектор.,"УЦЕНКА! СКИДКА 60%. Флуоресцентное полотно 50х50 см.
Всего за 750 р вместо 2тр.
Очаровательное изделие, которое добавит особый шарм вашему интерьеру. Стиль и индивидуальность в каждой детали!
Идеальная печать без дефектов.
Причина: неровный подшив. незаметно после натяжения за петли.",50x50,1,750,на складе,,,,
AZTEC,Флуоресцентное полотно Мандала Ацтеков.,"УЦЕНКА! СКИДКА 60%. Ацтек Мандала 50х50 см.
Всего за 750р вместо 2тр.
Идеально для любителей необычного. Не упустите шанс добавить яркий акцент в интерьер! 
Причина: незаметный брак печати.",50x50,3,750,на складе,,,,
THAICHILL,Флуоресцентное полотно Тайских Монах.,"УЦЕНКА! СКИДКА 50%. Флуоресцентное полотно 75х50 см.
Всего за 990 р вместо 2тр.
Идеальная печать без дефектов. Прекрасная композиция, которая добавит неповторимый шарм вашему пространству. Создайте уют с оригинальным декором!
Причина: неровный подшив. незаметно после натяжения за петли.",75x50,1,990,на складе,,,,
HANUMAN,Флуоресцентное полотно Хануман.,"УЦЕНКА! СКИДКА 50%. Флуоресцентное полотно 75х50 см.
Всего за 990 р вместо 2тр.
Идеальная печать без дефектов. Флюрное полотно с Хануманом для вашего дома. Прекрасно впишется в любой интерьер, добавляя изюминку и шарм.
Причина: неровный подшив. незаметно после натяжения за петли.",75x50,1,990,на складе,,,,
LIBERTYCAP,Флуоресцентное полотно В Лесу.,"УЦЕНКА! СКИДКА 50%. Флуоресцентное полотно 75х50 см.
Всего за 990 р вместо 2тр.
Изящное полотно с лесной атмосферой. Отличное дополнение для создания стильного и уютного пространства. Не упустите возможность!
Идеальная печать без дефектов.
Причина: неровный подшив. незаметно после натяжения за петли.",75x50,1,990,на складе,,,,
SARASVATI,Флуоресцентное полотно Сарасвати.,"УЦЕНКА! СКИДКА 50%. Флуоресцентное полотно 75х50 см.
Всего за 990 р вместо 2тр.
Красивое произведение искусства с богиней творчества , музыки и поэзии, Сарасвати. Добавьте индивидуальности в ваш дом с этим оригинальным предметом декора.
Идеальная печать без дефектов.
Причина: неровный подшив. незаметно после натяжения за петли.",75x50,1,990,на складе,,,,
SHIVASHAKTI,Флуоресцентное полотно Шакти и Шива.,"УЦЕНКА! СКИДКА 50%. Флуоресцентное полотно 75х50 см.
Всего за 990 р вместо 2тр.
Уникальное полотно с небольшим дефектом в подшиве. Превратите недостаток в достоинство и создайте уют в вашем пространстве!
Идеальная печать без дефектов.
Причина: неровный подшив. незаметно после натяжения за петли.",75x50,1,990,на складе,,,,
DRAGON,Флуоресцентное полотно В Лесу.,"УЦЕНКА! СКИДКА 40%. Флуоресцентное полотно 75х50 см.
Всего за 2450 р вместо 4тр.
Сказки о Драконах — волшебное полотно. Идеально для создания атмосферного уголка в вашем доме!",110х70 ,1,2450,на складе,,,,
HALAGREEN,Флуоресцентное полотно Восточный орнамент.,"РАСПРОДАЖА. 1.5х1м СКИДКА 1000р. ПОЛОТНО ИДЕАЛЬНОЕ, БЕЗ ИЗЪЯНОВ. 
Уникальное изделие без дефектов, в единственном экземпляре в такой расцветке. Прекрасный выбор для тех, кто ценит стиль и оригинальность. Не упустите свой шанс!",1.5x1,1,5000,на складе,,,,
HALABLUE,Флуоресцентное полотно Арабская ночь.,"ЕДИНСТВЕННЫЙ ЭКЗЕМПЛЯР. 1.5х1м. СКИДКА 1000Р. 
Отличное качество и уникальный дизайн. Полотно идеальное без дефектов, изготовлено в единственном экземпляре в холодной цветовой гамме. Порадуйте себя или близких неповторимым акцентом в интерьере!",1.5x1,1,5000,на складе,,,,
LADOGA,Флуоресцентная репродукция Ладожское Озеро.,"ЕДИНСТВЕННЫЙ ЭКЗЕМПЛЯР. 75х50см. СКИДКА 500Р. 
Уникальное изделие без дефектов, в единственном экземпляре. Репродукция моей оригинальной акриловой работы с эффектом свечения в ультрафиолете и неоне. Отличный вариант для тех, кто хочет добавить стиль и индивидуальность в свой интерьер.",75x50,1,1500,на складе,,,,
SHIVALINGAM,Флуоресцентная репродукция Шивалингам.,"ЕДИНСТВЕННЫЙ ЭКЗЕМПЛЯР. 75х75см. СКИДКА 1500Р.  Всего за 2тр вместо 3.5тр.
Уникальное изделие без дефектов, в единственном экземпляре. Репродукция моей оригинальной акриловой работы с эффектом свечения в ультрафиолете и неоне. 
Стильный акцент для вашего дома, который не оставит равнодушным!",75x75,2,1999,на складе,,,,
PILLOWS,Флюрные подушки.,"РАСПРОДАЖА. Флюрные ПОДУШКИ 50х50 см — мягкие и яркие! Скидка 1000 р при покупке 2-х или 3х штук сразу. Наполнитель синтепух, удобные и приятные на ощупь. В наличии: 2 зеленых Мандала и 1 синяя Ацтек Мандала. Создайте уют с яркими акцентами!",50х50см,3,2500,на складе,,,,